,word_guesses,first_pass,solution_words,solution
0,do;ari;re;ante,do C CI ari NF re SC ante,Doccia;rinfrescante,Doccia rinfrescante
1,verme;ori;ala;osa,A verme M ori ala C UN osa,Aver;memoria;lacunosa,Aver memoria lacunosa
2,mazzo;eco;raggio,A mazzo N eco raggio SA,Amazzone;coraggiosa,Amazzone coraggiosa
3,re;storico;sci;totale,P re TE storico NO sci U totale,Pretesto;rinconosciuto;tale,Pretesto rinconosciuto tale
4,orme;destre;ori;ore,N orme destre M ori G ore,Norme;d;estremo;rigore,Norme d'estremo rigore
5,pire;cent,TEM pire cent I,Tempi;recenti,Tempi recenti
6,fra;chef;tre;mare,CI fra chef A tre mare,Cifra;che;fa;tremare,Cifra che fa tremare
7,Eva;letti;ori,TR Eva L letti M ori,Tre;valletti;mori,Tre valletti mori
8,ara;con,R ara I con A,Rara;icona,Rara icona
9,tra;colli;tali,tra colli F A tali,Tracolli;fatali,Tracolli fatali
10,tanica;rose,LON tanica rose LLI,Lontani;caroselli,Lontani caroselli
11,rea;oliva;abili,P rea MB oliva RI abili,Preamboli;variabili,Preamboli variabili
12,tori;come;va;sta,S tori come DI E va LI sta,Storico;medievalista,Storico medievalista
13,la;maestra,la maestra TTA,Lama;estratta,Lama estratta
14,ari;posta;auto;aria,U N ari S posta auto RI T aria,Una;risposta;autoritaria,Una risposta autoritaria
15,aro;travi;Ate,P aro L E travi S Ate,Parole;travisate,Parole travisate
16,fischietti,O R A fischietti,Orafi;schietti,Orafi schietti
17,re;via;ring,B re via R ring HE,Brevi;arringhe,Brevi arringhe
18,est;cime;chini,G est A C cime S chini,Gestacci;meschini,Gestacci meschini
19,Ares;tra;dinari,F Ares tra O R dinari,Fare;straordinari,Fare straordinari
20,armo;Tosca;ore,F armo L Tosca LP ore,Far;molto;scalpore,Far molto scalpore
21,rade;Olivia;etti,G rade V Olivia G G etti,Gradevoli;viaggetti,Gradevoli viaggetti
22,Nasser;tori;colo,U Nasser tori D I colo,Un;asserto;ridicolo,Un asserto ridicolo
23,toppe;etto,S toppe RF etto,Stop;perfetto,Stop perfetto
24,sposi;nidi;armi,E sposi ZI O nidi M armi,Esposizioni;di;marmi,Esposizioni di marmi
25,di;capo;di;stria,RA di O capo di stria,Radio;capodistria,Radio capodistria
26,alati;vialetto,M alati GRA vialetto,Malati;gravi;a;letto,Malati gravi a letto
27,ode;tea;re,M ode S tea LTU re,Modeste;alture,Modeste alture
28,gru;oca;rosa;do,gru PP oca N O rosa R do,Gruppo;canoro;sardo,Gruppo canoro sardo
29,sola;eco;teoria,I sola eco teoria,Isola;ecoeteria,Isola ecoeteria
30,con;fez;arma;telline,con fez I O N arma N telline,Confezionar;mantelline,Confezionar mantelline
31,Bambi;nodi;Sordi;nato,Bambi nodi Sordi nato,Bambino;disordinato,Bambino disordinato
32,Ostia;tea,P Ostia tea TRO,Posti;a;teatro,Posti a teatro
33,viole;asce,viole N T asce N A,Violenta;scena,Violenta scena
34,stradino;tana;ali,MO stradino VI tana V ali,Mostra;di;novità;navali,Mostra di novità navali
35,re;sta;in;tram;abile,re GI sta in tram ON T abile,Regista;intramontabile,Regista intramontabile
36,est;conci;tori,G est I conci LI A tori,Gesti;conciliatori,Gesti conciliatori
37,tori;mani;stazione,S tori C A mani FE stazione,Storica;manifestazione,Storica manifestazione
38,stia;ratti,VA stia NF ratti,Vasti;anfratti,Vasti anfratti
39,cale;Rina,BOC cale PO Rina,Bocca;leporina,Bocca leporina
40,astri;catodi;nato,L astri catodi S E G nato,Lastricato;disegnato,Lastricato disegnato
41,unte;timo;echi,unte S timo N echi A VE,Un;testimone;chiave,Un testimone chiave
42,sponde;ramo;si;la,R I sponde ramo NO si L la BI,Risponder;a;monosillabi,Risponder a monosillabi
43,piedini;campi,S piedini D IS campi,Spiedini;di;scampi,Spiedini di scampi
44,legge;rei;re;dente,E legge rei L P re SI dente,Eleggere;il;presidente,Eleggere il presidente
45,re;Ares;menti,re S T Ares G O menti,Restare;sgomenti,Restare sgomenti
46,avi;la;resta;are,U N avi L la DA resta U R are,Una;villa;da;restaurare,Una villa da restaurare
47,ori;petti,GON ori SOS petti,Gonoriso;spettiti,Gonoriso spettiti
48,visione;Ti,visione S Ti,Visi;onesti,Visi onesti
49,colo;bivi;tori,colo M bivi A G GI A tori,Colombi;viaggiatori,Colombi viaggiatori
50,agente;ditali,L agente ditali A,La;gente;d;Italia,La gente d'Italia
51,dive;rami,dive NTA rami C I,Diventar;amici,Diventar amici
52,epe;sci;la,TR epe sci PA L la,Tre;pesci;palla,Tre pesci palla
53,gilet;ore;ali;ante,A gilet ore R O D ali C ante,Agile;torero;d;alicante,Agile torero d'alicante
54,Rod;Tosca;ente,P Rod OT Tosca D ente,Prodotto;scadente,Prodotto scadente
55,bus;topi;nodi;mogli,AR bus topi E nodi G E R mogli,Arbusto;pieno;di;germogli,Arbusto pieno di germogli
56,nata;adipe;ori;ante,U nata R adipe S ori LEV ante,Una;tara;di;peso;rilevante,Una tara di peso rilevante
57,est;anello;api;osa,SI est anello R api U A F osa,Siesta;nell;ora;più;afosa,Siesta nell'ora più afosa
58,pio;pia,pio P pia LTI,Pioppi;alti,Pioppi alti
59,osso;Vi;ali,CA osso Vi ali,Caos;soviali,Caos soviali
60,rio;mano;redi;menti;mici,CU rio SE mano V redi ELE menti NE mici,Curiose;manovre;di;elementi;nemici,Curiose manovre di elementi nemici
61,ara;resta;re,T ara resta D E re,Tarare;stadere,Tarare stadere
62,Ra;epe;lista,G Ra ND epe NA lista,Grande;penalista,Grande penalista
63,su;cera;gazze,su DI cera gazze,Sudice;ragazze,Sudice ragazze
64,merinos;mi;olla,D A merinos mi D olla TO,Damerino;smidollato,Damerino smidollato
65,Atene;are;gala,C Atene L L are gala TA,Catenella;regalata,Catenella regalata
66,ante;ape;ante,M ante LL ape S ante,Mantella;pesante,Mantella pesante
67,divo;remo;tele;corni,divo RA remo L tele C corni E,Divorare;molte;leccornie,Divorare molte leccornie
68,pane;osa,CAP pane BBI osa,Cappa;nebbiosa,Cappa nebbiosa
69,ossi;ras;sai;lumino,D ossi E ras sai VO lumino SO,Dossier;assai;voluminoso,Dossier assai voluminoso
70,fiasco;raggi,M A fiasco raggi A T A,Mafia;scoraggiata,Mafia scoraggiata
71,grandinata,grandinata NTI,Grandi;natanti,Grandi natanti
72,cono;cima;ali,E cono MI cima N U ali,Economici;manuali,Economici manuali
73,ovali;adipe;orso,N U ovali NE adipe RC orso,Nuova;linea;di;percorso,Nuova linea di percorso
74,osti;letto;lese,L osti VA letto M A lese,Lo;stivaletto;malese,Lo stivaletto malese
75,re;armeno,SP re C armeno,Sprecar;meno,Sprecar meno
76,fon;ode;api;sci,fon D ode L L api sci NA,Fondo;della;piscina,Fondo della piscina
77,est;remi,MA est remi OP I,Maestre;miopi,Maestre miopi
78,ava;pia;tir;busto,L ava pia T tir O busto,Lavapiatti;robusto,Lavapiatti robusto
79,arpe;Ra;isola,ST arpe Ra PP isola RSI,Star;per;appisolarsi,Star per appisolarsi
80,ellissi;odi;ante,B ellissi M odi A M ante,Bellissimo;diamante,Bellissimo diamante
81,mesti;con;egro,D O mesti con egro,Domestico;negro,Domestico negro
82,colo;coni;ale,VIN colo coni U G ale,Vincolo;coniugale,Vincolo coniugale
83,ciocco;tini;denti,ciocco LA tini F O N denti,Cioccolatini;fondenti,Cioccolatini fondenti
84,stia;Eva;nato,BE stia M Eva CCI nato,Bestiame;vaccinato,Bestiame vaccinato
85,asce;ore;ari;para,asce N S ore D ari para RE,Ascensore;da;riparare,Ascensore da riparare
86,taglia;bus,A L taglia bus I,Alt;agli;abusi,Alt agli abusi
87,pia;pie,pia ZZE pie NE,Piazze;piene,Piazze piene
88,giara;azza,LI giara G azza,Ligia;ragazza,Ligia ragazza
89,chiesa;ori;armi,chiesa N ori S P armi A,Chi;è;sano;risparmia,Chi è sano risparmia
90,nel;lido,A nel lido RO,Anelli;d;oro,Anelli d'oro
91,ali;ape;ala;ile,S ali T ape D ala B ile,Salita;pedalabile,Salita pedalabile
92,in;settima;va,in settima L va GI,Insetti;malvagi,Insetti malvagi
93,Ebe;dee;Ate,PR Ebe N dee LEV Ate,Prebende;elevate,Prebende elevate
94,api;coli;are;alta;are;tana,D api C coli L are alta A PP are LON tana,Da;piccoli;la;realtà;appare;lontana,Da piccoli la realtà appare lontana
95,ave;mici,ave R NE mici,Aver;nemici,Aver nemici
96,api;oli;etti,C api T oli L etti,Capitoli;letti,Capitoli letti
97,trofeo;re,S trofeo SCU re,Strofe;oscure,Strofe oscure
98,triste;reo,NAS triste reo,Nastri;stereo,Nastri stereo
99,porta;mento;mora,COM porta mento A mora LE,Comportamento;amorale,Comportamento amorale
100,sedano;menti;are,CO sedano N DI menti C are,Cose;da;non;dimenticare,Cose da non dimenticare
101,est;arpa;re,est ER N arpa U re,Esternar;paure,Esternar paure
102,lava;zaino;dente,lava CAN zaino CC I dente,La;vacanza;in;occidente,La vacanza in occidente
103,collo;oste;ile,collo Q UI oste R ile,Colloquio;sterile,Colloquio sterile
104,vi;va;presa,vi va SOR presa,Viva;sorpresa,Viva sorpresa
105,perso;ari;osa,perso N ari OT T osa,Persona;riottosa,Persona riottosa
106,est;est;ali,L est RAD est A T ali,Le;strade;statali,Le strade statali
107,rete;zio;Sam;ode,P rete N zio Sam ode LLA,Pretensiosa;modella,Pretensiosa modella
108,serpe;Dante,E S serpe Dante,Esser;pedante,Esser pedante
109,aglio;pera;pera;agli,SB aglio pera T I pera B B agli,Sbagli;operati;per;abbagli,Sbagli operati per abbagli
110,pira;tine,I pira tine GRI,I;pirati;negri,I pirati negri
111,van;Ale;numi,V I van Ale numi D O,Vivana;le;numido,Vivana le numido
112,gru;podista;Edipo;cella,gru P podista TU Edipo R cella NA,Gruppo;di;statue;di;porcellana,Gruppo di statue di porcellana
113,unto;casa;ami;colo,unto C casa N ami R A colo SO,Un;toccasana;miracoloso,Un toccasana miracoloso
114,di;trattore;lato,di S trattore lato RE,Distratto;relatore,Distratto relatore
115,pia;erta,pia NG erta NTO,Pianger;tanto,Pianger tanto
116,pera;oche;avo;rane;orto,O pera I oche L avo rane L P orto,Operaio;che;lavora;nel;porto,Operaio che lavora nel porto
117,tele;si;nei;liana,tele V I si O nei T A liana,Televisione;italiana,Televisione italiana
118,venti;diga,E venti diga LA,Eventi;di;gala,Eventi di gala
119,ambi;navi;ami,B ambi navi E TN ami T A,Bambina;vietnamita,Bambina vietnamita
120,pera;aria,O pera MUR aria,Opera;muraria,Opera muraria
121,pesca;per;oca,pesca per C oca,Pesca;percoca,Pesca percoca
122,code;sordi,D I S code sordi O,Disco;d;esordio,Disco d'esordio
123,amo;solido,F amo solido,Famoso;lido,Famoso lido
124,onda;redi;orsi,SFR onda redi S C orsi,Sfrondare;discorsi,Sfrondare discorsi
125,piedini;chili,UTO piedini chili STA,Utopie;di;nichilista,Utopie di nichilista
126,amo;rosa;tea;azza,CL amo rosa RE tea L ME azza,Clamorosa;rete;al;meazza,Clamorosa rete al meazza
127,croci;rape;sale,croci E rape R sale C CO,Crociera;per;Salsacco,Crociera per Salsacco
128,do;ali;aria,CE do L ali BR aria,Cedola;libraria,Cedola libraria
129,arco;code,F arco C code,Far;coccodè,Far coccodè
130,oca;arte;scope,GI oca RAC arte scope R TE,Giocar;a;carte;scoperte,Giocar a carte scoperte
131,asola;remo;est,C asola remo D est O,Casolare;modesto,Casolare modesto
132,est;Ares;azza,R est Ares PI azza TI,Restare;spiazzati,Restare spiazzati
133,are;telo;tana,P are N telo N tana,Parente;lontana,Parente lontana
134,Po;teca;ami,Po TEN teca L ami T A,Potente;calamità,Potente calamità
135,rete;odi;amo;ara;azza,CUO rete NER odi NN amo RAT ara G azza,Cuore;tenero;d;innamorata;ragazza,Cuore tenero d'innamorata ragazza
136,scia;come,scia DI come TA,Scia;di;cometa,Scia di cometa
137,nove;re;con;do,N O N nove re con do,Nonno;verecondo,Nonno verecondo
138,rose;lime;dio;ali,C A rose L lime dio E V ali,Caroselli;medioevali,Caroselli medioevali
139,nari;citato;urne,U nari US citato urne E,Una;riuscita;tournée,Una riuscita tournée
140,la;metro;poli;tana;pari;Gina,la metro poli tana pari Gina,La;metropolitana;parigina,La metropolitana parigina
141,nari;arti;zio;Qua,U nari P arti zio N EE Qua,Una;ripartizione;equa,Una ripartizione equa
142,re;alice;nati,re G alice S T I nati,Regali;cestinati,Regali cestinati
143,su;mela;alto,AS su mela PP alto,Assume;l;appalto,Assume l'appalto
144,Ella;ora;ori;odi;atti,B Ella B ora T ori odi D atti C O,Bel;laboratorio;didattico,Bel laboratorio didattico
145,lisca;ali,UTI lisca F F ali,Utili;scaffali,Utili scaffali
146,ambo;lame;cani,B ambo lame C cani CA,Bambola;meccanica,Bambola meccanica
147,ilare;re;porta;belli,ST ilare re porta GE belli CI,Stilare;reportage;bellici,Stilare reportage bellici
148,fon;ago;amo;tana,PRO fon D ago L amo N tana,Profonda;gola;montana,Profonda gola montana
149,asta;sci;tasca,P asta sci UT tasca RSA,Pastasciutta;scarsa,Pastasciutta scarsa
150,pia;lati,CA pia D U lati,Capi;adulati,Capi adulati
151,Bach;cane,Bach E cane RA,Bacheca;nera,Bacheca nera
152,dio;sale;Ra,TE dio sale TT U Ra,Tediosa;lettura,Tediosa lettura
153,sardine;are,O sardine G are,Osar;di;negare,Osar di negare
154,ilari;dal;bere,F ilari dal bere L LI,Filari;d;alberelli,Filari d'alberelli
155,ara;Eros;Era;pia,F ara Eros OL T Era pia,Far;aerosolterapia,Far aerosolterapia
156,cane;odi;mini,cane S TR odi VI mini,Canestro;di;vimini,Canestro di vimini
157,ali;ami;chela;iole,S C ali N A T ami chela NG iole SCA,Scalinata;michelangiolesca,Scalinata michelangiolesca
158,lame;pia;tino,S A lame pia CE N tino,Salame;piacentino,Salame piacentino
159,su;nidi;oli,su O nidi V I oli NI,Suoni;di;violini,Suoni di violini
160,ninfa;medi;ceri,U ninfa medi ceri A,Un;infame;diceria,Un'infame diceria
161,indi;uomo;est,indi V I D uomo L est O,Individuo;molesto,Individuo molesto
162,fa;resta;ante,AF fa resta G N ante,Affare;stagnante,Affare stagnante
163,ali;nera;azze,M ali G nera G azze,Maligne;ragazze,Maligne ragazze
164,usci;rea;cere,R I usci rea V I N cere,Riuscire;a;vincere,Riuscire a vincere
165,re;gola;avi,S re gola T avi T A,Sregolata;vita,Sregolata vita
166,con;ras;tanti;mori,con T ras tanti U mori,Contrastanti;umori,Contrastanti umori
167,vene;lira;azze,S vene VO lira G azze,Svenevoli;ragazze,Svenevoli ragazze
168,iuta;epe;coli,F iuta R epe R I coli,Fiutare;pericoli,Fiutare pericoli
169,cari;cocomeri;est,cari cocomeri CH I est O,Carico;come;richiesto,Carico come richiesto
170,fanti;lepre;est,I N fanti lepre T est O,Infantile;pretesto,Infantile pretesto
171,latte;sano;mina,latte sano mina,L;attesa;nomina,L'attesa nomina
172,usa;la;cera,BL usa la cera TA,Blusa;lacerata,Blusa lacerata
173,anca;nero,C anca nero CK,Cancan;e;rock,Cancan e rock
174,anca;redi;in,M anca redi S T in TO,Mancare;d;istinto,Mancare d'istinto
175,seria;etti,ES seria B B I etti,Esseri;abbietti,Esseri abbietti
176,api;tanica;riccio,C api tanica P riccio SI,Capitani;capricciosi,Capitani capricciosi
177,osso;naso;tana,GR osso LA naso T tana,Grossolana;sottana,Grossolana sottana
178,otarde;leve;redi;orsi,N otarde L leve redi ST orsi O NI,Notar;delle;vere;distorsioni,Notar delle vere distorsioni
179,do;eco;raggio,do N N eco raggio SE,Donne;coraggiose,Donne coraggiose
180,Pan;coi;orsa,Pan I coi N B orsa,Panico;in;borsa,Panico in borsa
181,Ughi;canti,S Ughi PI C canti,Sughi;piccanti,Sughi piccanti
182,ali;erta;gola;rei;tini;dei;poli,E L ali B erta ARE gola rei D E S tini dei P O poli,È;la;libertà;a;regolare;i;destini;dei;popoli,È la libertà a regolare i destini dei popoli
183,pie;astici,CO R pie L astici,Corpi;elastici,Corpi elastici
184,ceri;fico;raggio,S ceri F fico raggio SI,Sceriffi;coraggiosi,Sceriffi coraggiosi
185,con;Vitti;Ranieri,con Vitti S T Ranieri,Convitti;stranieri,Convitti stranieri
186,dita;tetra;di;zio;siepe;salame;ori,dita N tetra di zio N I siepe R salame M ori A,Di;tante;tradizioni;si;è;persa;la;memoria,Di tante tradizioni si è persa la memoria
187,diva;Oscar,diva RI Oscar SO,Divario;scarso,Divario scarso
188,ava;lima;lenti,C ava L lima C I lenti,Cavalli;macilenti,Cavalli macilenti
189,stop;nodo;Venere,FU stop IE nodo LI Venere,Fusto;pieno;d;olive;nere,Fusto pieno d'olive nere
190,nave;re;anche;dadi,NO nave re G R anche dadi R E,Non;avere;granché;da;dire,Non avere granché da dire
191,divi;Ares;agli,IN divi DU Ares PI R agli,Individuare;spiragli,Individuare spiragli
192,avi;ami;ramo;agente,F avi T ami SE ramo LT agente,Fa;vita;misera;molta;gente,Fa vita misera molta gente
193,con;gru;tali,"con gru I VI, tali ZI",Congrui;vitalizi,Congrui vitalizi
194,mas;rospi;orcio,mas S A rospi L orcio,Massaro;spilorcio,Massaro spilorcio
195,teso;ali,QUO teso C I ali,Quote;sociali,Quote sociali
196,stia;la;menti,VA stia L la GA menti,Vasti;allagamenti,Vasti allagamenti
197,trave;arca;pie;tesi,AT trave RS arca M pie S tesi,Attraversar;campi;estesi,Attraversar campi estesi
198,mi;cavi;uosa,A mi cavi R T uosa,Amica;virtuosa,Amica virtuosa
199,irco;in;lenza,AG irco N in DO lenza,Agir;con;indolenza,Agir con indolenza
200,sci;arsi;cappa;etto,L A sci arsi S cappa R D etto,Lasciarsi;scappar;detto,Lasciarsi scappar detto
201,ambi;Era;nato,ambi EN T Era FFI nato,Ambiente;raffinato,Ambiente raffinato
202,fra;are;re;si,AF fra N C are SP re S si,Affrancar;espressi,Affrancar espressi
203,sotto;conca;pesante,RI sotto conca pesante,Risotto;con;capesante,Risotto con capesante
204,fa;volo;ala;tricheco;nassa,fa volo SI ala BAS tricheco STA nassa I,Favolosi;alabastri;che;costan;assai,Favolosi alabastri che costan assai
205,attore;tra,attore GIS tra T O,Atto;registrato,Atto registrato
206,asse;oche;api;cere,asse N S oche F api A cere,Assenso;che;fa;piacere,Assenso che fa piacere
207,in;astrologo,in C astrologo RO,Incastro;logoro,Incastro logoro
208,uovo;mignolo,N uovo NO mignolo,Nuovo;nomignolo,Nuovo nomignolo
209,con;tata;cena;gelosia,S con tata S cena DI gelosia,Scontata;scena;di;gelosia,Scontata scena di gelosia
210,in;tensione,in tensione RI,Intensi;oneri,Intensi oneri
211,lisca;nati,FOL lisca T E nati,Folli;scatenati,Folli scatenati
212,medi;alati,CO M medi alati NA,Commedia;latina,Commedia latina
213,asce;lima;sci,V asce L lima L GA sci,Vascelli;malgasci,Vascelli malgasci
214,si;redo;tenda,si G NO redo S tenda,Signore;d;Ostenda,Signore d'Ostenda
215,cari;dadi,cari CO dadi E CI,Carico;da;dieci,Carico da dieci
216,temi;Ra;tori,ROT temi G Ra tori E,Rotte;migratorie,Rotte migratorie
217,la;mente;la;sporta,la mente la sporta,Lamentela;sporta,Lamentela sporta
218,onda;remo;stia,N onda remo L E stia,Non;dare;molestia,Non dare molestia
219,conte;platano,conte M platano RMA,Contemplata;norma,Contemplata norma
220,sole;tre;miti,I sole tre miti,Isole;tremiti,Isole tremiti
221,lapis;ascari,lapis TOL ascari C A,La;pistola;scarica,La pistola scarica
222,ali;di;mosca,V I ali di mosca,Viali;di;Mosca,Viali di Mosca
223,ante;dita;bar,C H ante U S E dita bar IN,Chanteuse;di;Tabarin,Chanteuse di Tabarin
224,ave;pie;nipote,ave R pie nipote RI,Aver;pieni;poteri,Aver pieni poteri
225,brocca;di;ras,brocca TO di ras O,Broccato;di;raso,Broccato di raso
226,re;ditali;data,re N ditali Q U I data,Rendita;liquidata,Rendita liquidata
227,pine;rie;orsa;in,CHE pine rie B orsa L in O,Chepì;neri;e;borsalino,Chepì neri e borsalino
228,mela;orate,LA mela V orate,Lame;lavorate,Lame lavorate
229,undici;torero;mani,undici torero mani S T A,Un;dicitore;romanista,Un dicitore romanista
230,sesti;osa,TO S sesti ZZ osa,Tosse;stizzosa,Tosse stizzosa
231,orti;Ero;mani,P orti ER Ero mani STA,Portiere;romanista,Portiere romanista
232,unte;rose;mento,unte N E rose N T I mento,Un;tenero;sentimento,Un tenero sentimento
233,eco;dardi;ala;vere;mais;ape;re;Don;are,eco dardi ala vere mais ape re Don are,È;codardia;l;aver;e;mai;sapere;donare,È codardia l'aver e mai sapere donare
234,modella;Eros;cola,RA modella LB Eros E cola RE,Ramo;dell;albero;secolare,Ramo dell'albero secolare
235,ritto;ria;ore;oli,SC ritto ria U T ore V oli,Scrittori;autorevoli,Scrittori autorevoli
236,sciarpa;are,LA sciarpa S S are,Lasciar;passare,Lasciar passare
237,nave;chiama;rada;re,U nave C chiama NI E rada MA re,Una;vecchia;maniera;d;amare,Una vecchia maniera d'amare
238,pere;peri;re,O pere IM peri TU re,Opere;imperiture,Opere imperiture
239,fra;semi;rata,fra semi rata,Frase;mirata,Frase mirata
240,are;tetri;tino,P are N tetri ES tino,Parente;triestino,Parente triestino
241,ala;ori;sai;tesa,UN ala B ori O sai N tesa,Una;laboriosa;intesa,Una laboriosa intesa
242,ape;navi;lana,UN ape RSO navi L lana,Una;persona;villana,Una persona villana
243,re;Iside;agli,P re C Iside TT agli,Precisi;dettagli,Precisi dettagli
244,Eros;ava;do,N Eros P ava L do,Nero;spavaldo,Nero spavaldo
245,lisca;polo,G lisca polo NI,Gli;scapoloni,Gli scapoloni
246,ancia;pia,P ancia pia TTA,Pancia;piatta,Pancia piatta
247,lente;anello;pera,lente Z Z anello pera RE,Lentezza;nell;operare,Lentezza nell'operare
248,do;Cipro;sedia;ante,do L Cipro ME S sedia M ante,Dolci;promesse;di;amante,Dolci promesse di amante
249,rive;rei;anni,rive L A rei N G anni,Rivelare;inganni,Rivelare inganni
250,ali;Ionio;oste,CO ali Z Ionio PP oste,Coalizioni;opposte,Coalizioni opposte
251,pedale;coda;nata,COP pedale ATI coda N nata,Coppe;d;aleatico;d;annata,Coppe d'aleatico d'annata
252,Ellade;orata,S Ellade C orata,Sella;decorata,Sella decorata
253,madie;vasi,FO R madie vasi O N E,Forma;di;evasione,Forma di evasione
254,onda;tino;navi,C onda NNA tino navi T A,Condannati;non;a;vita,Condannati non a vita
255,chiesa;Ra;esche,VEC chiesa Ra C I N esche,Vecchie;saracinesche,Vecchie saracinesche
256,belgi;odi;ali,belgi R odi T ali A,Bel;giro;d;Italia,Bel giro d'Italia
257,va;nano;leggio,va nano leggio,Van;a;noleggio,Van a noleggio
258,attirati;Ati,attirati F I C Ati,Atti;ratificati,Atti ratificati
259,anitre;mi,ST R anitre mi TI,Strani;tremiti,Strani tremiti
260,cima;tini;re,VO cima T tini E re,Voci;mattiniere,Voci mattiniere
261,belve;cetra;Bacco,belve L O cetra Bacco LO,Bel;veloce;trabaccolo,Bel veloce trabaccolo
262,cola;esca;nate,S cola R esca T E nate,Scolare;scatenate,Scolare scatenate
263,arti;icona;ile,arti S T icona R G H ile,Artistico;narghilè,Artistico narghilè
264,Eva;Degas;Ate,B Eva N Degas S Ate,Bevande;gassate,Bevande gassate
265,in;gerle;asce,"STR, in gerle GAN, asce",Stringer;le;ganasce,Stringer le ganasce
266,arma;nassa;lente,B arma nassa I VA lente,Barman;assai;valente,Barman assai valente
267,parente,AP parente d'Isacco RDO,Apparente;disaccordo,Apparente disaccordo
268,mese;mici;cola,LA mese mici R cola R I,Lame;semicircolari,Lame semicircolari
269,in;vasi;dalie,in vasi ONE dalie NI,Invasione;d;alieni,Invasione d'alieni
270,mani;Adige;lato,mani Adige lato,Mania;di;gelato,Mania di gelato
271,nonno;redi;versi,nonno T A redi versi TA,Non;notare;diversità,Non notare diversità
272,dadi;nata,C O dadi ME nata,Coda;dimenata,Coda dimenata
273,budino;madia;cani,TRI budino madia F R I cani,Tribù;di;nomadi;africani,Tribù di nomadi africani
274,Sinatra;data,CA Sinatra SAN data,Casina;trasandata,Casina trasandata
275,unto;tema;eco,unto tema Z T eco,Un;totem;azteco,Un totem azteco
276,pelli;lana;ali,pelli CO lana T ali ZI A,Pellicola;natalizia,Pellicola natalizia
277,idolo;ila;Era,idolo R ila C Era NO,I;dolori;lacerano,I dolori lacerano
278,di;rame,di rame N,Dir;amen,Dir amen
279,Po;Ticino;Como,UN Po S Ticino Como DO,Un;posticino;comodo,Un posticino comodo
280,re;nane;lira,re G nane L lira N,Regna;nell;Iran,Regna nell'Iran
281,pia;arco;come,pia N T arco come R I,Piantar;cocomeri,Piantar cocomeri
282,Chio;rime;Eva,Chio ST rime DI Eva LI,Chiostri;medievali,Chiostri medievali
283,rovo;carta;Po;menti,P rovo carta M Po N A menti,Provocar;tamponamenti,Provocar tamponamenti
284,rive;tini,SO B rive STI tini,Sobri;vestitini,Sobri vestitini
285,sordi;avi,sordi D avi T A,Sordida;vita,Sordida vita
286,orsa;pica;aglio;coli,C orsa IP pica aglio S T A coli,Corsa;ippica;agli;ostacoli,Corsa ippica agli ostacoli
287,aliscafo;nata,OD aliscafo RTU nata,Odalisca;fortunata,Odalisca fortunata
288,Bari;eco;ode;teste,Bari L eco LM ode S teste ST,Barile;colmo;d;est;est;est,Barile colmo d'est est est
289,re;Cita;sci;Alba,re Cita sci Alba,Recita;scialba,Recita scialba
290,timo;la;tea;mento,S timo la N tea R GO mento,Stimolante;argomento,Stimolante argomento
291,pinza;icona;dita,RIM pinza RS icona VI dita,Rimpinzarsi;con;avidità,Rimpinzarsi con avidità
292,su;nome;di,su O nome LO di OSO,Suono;melodioso,Suono melodioso
293,ora;nei;pirata,ora ZI O nei S pirata,Orazione;ispirata,Orazione ispirata
294,vino;tinella;reo,DI vino TA tinella E reo,Divi;notati;nell;aereo,Divi notati nell'aereo
295,avi;mento;ala;re,P avi mento D ala V A re,Pavimento;da;lavare,Pavimento da lavare
296,Ares;vere,G Ares E vere,Gare;severe,Gare severe
297,in;opera;mici,in VI T opera mici,Invito;per;amici,Invito per amici
298,conte;ovali,conte GGI ovali D O,Conteggio;valido,Conteggio valido
299,nasse;gnomo;est,U nasse gnomo D est O,Un;assegno;modesto,Un assegno modesto
300,Arno;Odino;ara,B Arno T Odino V ara,Bar;noto;di;Novara,Bar noto di Novara
301,ore;aste;nata,F ore ST aste RMI nata,Foresta;sterminata,Foresta sterminata
302,corno;neve,AN corno neve RO,Ancor;non;è;vero,Ancor non è vero
303,la;re;fa;re;re,la M O re fa C re S CE re,L;amore;fa;crescere,L'amore fa crescere
304,carponi;ditali,S carponi ditali A,Scarponi;d;Italia,Scarponi d'Italia
305,atrio;casetta,P atrio TTI casetta,Patriottica;setta,Patriottica setta
306,colletti;Itaca;lana,colletti V Itaca T A lana,Collettività;catalana,Collettività catalana
307,azza;menti;ore;oli,PI azza menti O N ore V oli,Piazzamenti;onorevoli,Piazzamenti onorevoli
308,olla;redi;ami,B olla redi N F ami A,Bollare;d;infamia,Bollare d'infamia
309,antico;letto,C antico letto,Cantico;letto,Cantico letto
310,per;navi,per SO navi L E,Persona;vile,Persona vile
311,mine;tele;Ade,E mine N tele Ade R,Eminente;leader,Eminente leader
312,nere;lame,T E nere lame D IA,Tenere;la;media,Tenere la media
313,ancora;gazze,ST ancora gazze T TO,Stanco;ragazzetto,Stanco ragazzetto
314,arti;chef;gora;zio,arti ST I chef OL gora zio NI,Artistiche;flogorazioni,Artistiche flogorazioni
315,ali;nodi;etto,CI C ali nodi F etto SO,Cicalino;difettoso,Cicalino difettoso
316,ara;beone,SC ara beone RO,Scarabeo;nero,Scarabeo nero
317,secondi;tacco,CO R secondi S tacco,Corse;con;distacco,Corse con distacco
318,pipa;oli;pini,AM pipa S C oli A L pini,Ampi;pascoli;alpini,Ampi pascoli alpini
319,esca;amo;ree;lenza,TR esca D amo ree V I O lenza,Tresca;d;amore;è;violenza,Tresca d'amore è violenza
320,divano;perla;su;elica;tabelle,divano T A perla su A D elica tabelle ZZ A,Diva;nota;per;la;sua;delicata;bellezza,Diva nota per la sua delicata bellezza
321,fon;dadi;mina,PRO fon dadi S A mina,Profonda;disamina,Profonda disamina
322,navi;adipe;ara,U navi adipe S C ara,Una;via;di;Pescara,Una via di Pescara
323,tutoli;erta;rio;mano,AS tutoli B erta rio R O mano,Astuto;libertario;romano,Astuto libertario romano
324,canestro;fedi;etti,AR canestro fedi S ON etti,Arcane;strofe;di;sonetti,Arcane strofe di sonetti
