,word_guesses,first_pass,solution_words,solution
1187,,PAS PIANO,Passer;un;vaso;piattino;Passer;un;vaso;piattino;P;a;sei;piattino;P;a;sei;piattino;P;a;sei,Passeggero
1188,,[Vale... dentro] = all,Alla;saleta;la;tana;Alla;saleta;la;tana;Alla;saleta;la;tana;Alla;saleta;la;tana;Alla;saleta;la;tana,All sala teca E santa A esercizio O
1189,Roma;dove;est;naufragio;dove;est;naufragio;dove;est,Roma NZ dove RI est,Romanzo;de Rique;;Naufragio;de Rique;;Naufragio;de Rique,Romanzo de Rique
1190,centauri;Oedipus;sì,Icaro R T Osi,Otto;Icaro;R T;Oedipus R;Icaro;R T;Oedipus R,Icaro R T Osi = Icaro R T Osi
1191,,CO PER,una;due;tre;quattro;cinque,Copertura
1192,,Tassinari N T risolse l'enigma della Sfinge,Sei,Tassinari N T risolse l'enigma della Sfinge = Tassinari N T risolse l'enigma della Sfinge
1193,,Isobel ZI O,,Isobel ZI O
1194,,TRAPANI,,Trapani
1195,api;Oscar;Tommaso,C api Oscar S TI Tommaso,Capi;po;sartigiano,Capi po sartigiano
1196,orsi;Re;Irene,T orsi A Re Irene E,Torsiar;eirene,Torsiar eirene
1197,,Sassano (Una provincia pugliese) lascia (Lo si lascia di mancia) LE (Attori popolari) Gange (Fiume dell' India) E,,Sassano lascia
1198,,CA [La scrive l' assente] = manoscritto,Manoscri;Tocco,manoscritto culto
1199,,CO COScienza,Cocci;scansiona;scealone,Coscienza
1200,,L'antenata RI sorella F reste UO antiruggine SI,,L'antenata RI sorella F reste UO antiruggine SI = L'antenata RI sorella F reste UO antiruggine SI
1201,,SE con O nautica Giura di dire tutta la verità S S O le Indie A S frati,Se cono nautica giura di dire tutta la verità;Se;cono;na;uatica;giura;di;dire;Se;cono;na;uatica;giura;di;dire;Se;cono;na;uatica;giura;di;dire;Se;cono;na;uatica;giura;di;dire;Se;cono;na;uatica;giura;di;dire;Se;cono;na;uatica;giura;di;dire,Se cono nautica giura di dire tutta la verità
1202,arbusti;Ceca;pane,P arbusti N Ceca M pane,Parbusti;ncecamp;;R;i;s;o;l;vi;sì;;P;a;r;r;i;s;i,Parbusti ncecamp
1203,,DI debito N Soggiorno S,Dibito;bit;sorbetto,Dibito
1204,,VI (spada) MI (mano) L (manica),Vista;spada;mano;manica;Vis;spada;mano;manica,
1205,,Ecco la soluzione,Ecco;la soluzione;alla;alla;la;soluzione;della;la;soluzione,
1206,,O pini O nichel caccia NO piastre T I,Opinioni;chi;caciano;piastre,Opinioni chi caciano piastre T I
1207,,La nota fondamentale V O pilaf S bucanieri,,La
1208,12;ad;Panna,12 N ad S Panna NE,Dici;ne;spannane,Dici ne spannane
1209,Messico;somme,SOM Messico M somme,Sommessa;cosomme,Sommessa cosomme
1210,orso;Circe;casupola;gioco;gioco;gioco,orso C Circe LDE,Orso;Cicer;;Casupola;Cgioco;;Gioco;Cgioco,Orso Cicer
1211,,U N O [Non più... barbute] [Sinonimo di sabbia],Un;uno;sabbia,Un'uno sabbia
1212,,CA [Il nome dell'attore Mineo] = Enio,Enio;Dà<|end|><|endoftext|>,Enio DA
1213,calce;aria,COP calce aria SI,Copac;ceraria,Copac ceraria
1214,Gange;lì;sci,MON: Gange lì O sci,Monge;gelliosi,Monge gelliosi
1215,,Tesoro Natale Ripari CCE,Testo;Ronata;Lipo;Ripari;Testo;Ronata;Lipo;Ripari;;Testo;Ronata;Lipo;Ripari;;Testo;Ronata;Lipo;Ripari;;Testo;Ronata;Lipo;Ripari;;Testo;Ronata;Lipo;Ripari;;Testo;Ronata;Lipo;Ripari,Tesoro Natale Ripari CCE
1216,,salita DIC in sicuramente Volga RI,Salita;dici;sicuramente,Salita dici sicuramente
1217,,U Nodi Sipari,,Unodi Sipari
1218,,[I successori di san Pietro] L [Sono simili ai castori] N DY,,Papi L
1219,,[Se pesa duole] RA P [Pregiato caucciù] TI M [Giunte in coda a tutte] DI [Il fiabesco Babà],,
1220,,Rana,,Rana
1221,,D U Marocco si mette sul ricercato,DUM;amaricato,DUMAR
1222,,ME giustizia [Gli unguenti di bellezza] DI Siena LE,Giustizia;Dische,Me giustizia = Giustizia
1223,,PA PPA,,Pappa
1224,coperchi;patate;scafo;alice;coperchi;patate;scafo,RI coperchi patate S scafo R V alice,Ricoper;c;chiappet;ascario;Ricoper;c;chiappet;ascario,Ricoper c chiappet ascario
1225,con;temeraria;piangere,Cappuccino,Cappucc;inera;Cappucc;inera,Cappuccino
1226,,,Lata;van;Aiuto;aiuto;Aiuto;aiuto,Lata van
1227,barche;remo,A R barche ST remo,Arbaro;chestremo,Arbaro chestremo
1228,pazzo;violino;alone,S pazzo L violino N T alone,Spazzolov;intonale,Spazzolov intonale
1229,calici;pistola,L O calici pistola NI,Locali;cipistolani,Locali cipistolani
1230,,U Nodi TT viso del leale R invento V Babà delleMille e una notte G sciacalli affiorano I,Un;odiettivo;si;dolle;un;invento;per;vivere;Un;odiettivo;si;dolle;un;invento;per;vivere;0;0;0;0;0;0,Unodi TT viso del leale R invento V Babà delleMille e una notte G sciacalli affiorano I
1231,orsi;alici,B orsi E D alici,Borse;edali,Borse edali
1232,,A L cademone ANteo Liceo,,Ad esempio
1233,,A Formaggi F I le prolunga l'attesa,Forma;gi;fila,Formaggi F I le prolunga l'attesa
1234,anni;parola;spighe,P anni parola S spighe,Panni;parolaspighe,Panni parolaspighe
1235,,G la MO ur la santi VO,Glamour;lassanti,Glamour lassanti
1236,,sci U Parigi O R nidi al Federico ZA,Sciupar;i;giornid;al;Federico,Sciupar i giornid al Federico ZA
1237,,A archi è oggetto di culto RIF terreni per pomodori e verdure F I si dirigono con la pagaia D E alto titolo nobiliare NO,,Archeo
1238,re;Franco;Curia,T re Franco Curia NTE,Trefort;Cura;;,Trefort Cura
1239,,CO P P,Cop;po;pasta;t;pasta;Cop;po;pasta;t;pasta;Coperta;po;pasta;t;pasta,Cop
1240,,O vento NC coda,Over;ten;coda,Over ten coda
1241,odori;equo,B R odori ST equo,Brodo;risoletto,Brodo risoletto
1242,,MU si concludono un accordo,,MU si concludono un accordo
1243,remare;seme;remare;seme;remare;seme;remare;seme;remare;seme,A remare U seme,Are;mareuses;A;re;mareuses;A;re;mareuses;A;re;mareuses,Are mareuses
1244,,TR Ava (parente in cornice),Trapasso;passa;sati,Trapasso
1245,risata;ritornati;gioiosi,S risata ritornati M gioiosi,Srisa;taronati,Srisa taronati
1246,,Siamo fra le armi più odiose,,Siamo fra le armi più odiose
1247,anemone;per,AL anemone per TI,Alane;monopeti,Alane monopeti
1248,pere;colli;esperto,E S pere E N colli MIT esperto,Esperienza;collimite,Esperienza collimite
1249,,Aviatore,,aviatore
1250,,finta balia lama balia,Finta;ba;lama balia,Finta ba lama balia
1251,,NOCI,,Nocciola
1252,,E DIAZ fu quello della Vittoria,Ediaz;fu;quello;della vittoria,E DIAZ fu quello della Vittoria
1253,,Antagonisti in amore,Ant;onisti,
1254,,IN creme Natale Canti,Incrimine;re;canti,Incrime
1255,,C in,Cincina;Tucano;tac,Cin
1256,,Sciave (fumarie) bobina (ancora) corte (cortigiani) B R A (dimora) rami (preposizione) A,Sciame,Sciame
1257,,[Molto religiosa] CEN [L' argomento di laurea] GN O [Non più... barbute] SS [Captano le onde],,
1258,ghiaia;media;amica;acacia,TI ghiaia media LTR amica V acacia,Tigre;a;Iamaid;al;tram;acacia,Tigre a Iamaid al tram acacia
1259,contro;delta;Coco;contro;delta;Coco,L contro delta Coco,L;contro;delta;L;contro;d;al;tac,L contro delta
1260,corsia;vie,UO corsia L vie,Uocor;sialvie,Uocor sialvie
1261,,AN [Sofia Loren lo è per Alessandra Mussolini] [Si prende al porto] DO [È da bagno per il bagno] LI G [Corre la cristiana],Ananas;fritto;disfatto,Ananas fritto disfatto
1262,,[Molto devote] T [Lucertolone di un bel verde smeraldo] NE,Molto;devote;Un cane che corre;un cane che corre;Un cane che corre;un cane che corre;Un cane che corre;un cane che corre,Molto devote
1263,,Cofano A Tale,,Cofano A Tale
1264,,Bugie Tare Ristori S E,Bugie;tarelistori,Bugie Tare Ristori S E
1265,trave;sala;tristi,V trave RSA sala tristi T A,Vtrave;rassalata;rist;istituta,Vtrave rassalata rist' istituta
1266,,I S corsari [Lo è chi non è... out] NI,Iscorsa;ria,Iscorsa ria
1267,,[Se estera è importata] D E [Vanno a finire sulle pietanze!] MA [Quello competente giudica],Salse;ma;giudice,salse MA giudice
1268,valigia;Usa,STI valigia Usa TI,Stivali;già;usati,Stivali già usati
1269,sassate;rami;sassate;rami,B sassate rami C I,Bassa;Sartre;;R;i s;ona;tate;Bassa;Sartre;;R;i s;ona;tate,Bassa Sartre
1270,cotte;ria,Cl cotte G ria,Clot;te;greia,Clot te greia
1271,,Sassano gracidano Liesolo RO,,Sassano gracidano Liesolo RO = Sassano gracidano Liesolo
1272,,pere O DO qui conti diavolo,Pereo;conti diavolo,Pereo conti diavolo
1273,,,Divano;Rifossa;C;Accaioni,Divano Rifossa C Accaioni
1274,,Toscana Asi Rasi,Tosca;na;asirasi,Toscana Asi Rasi
1275,okra;il;capi,C okra NSI il capi,Col;kansilapichi,Col kansilapichi
1276,arti;totem;toghe,P arti totem R toghe SE,Partito;metrotoghe,Partito metrotoghe
1277,,Cotta NT malva T,Cottan;malvat;Cottan;malvat;;Cottan;malvat;;Cottan;malvat;;Cottan;malvat;;Cottan;malvat;;Cottan;malvat;;Cottan;malvat;;Cottan;malvat;;Cottan;malvat,Cotta NT malva T = Cotta NT malva T
1278,,DI palma LE,,Palma
1279,,ACCARE,=;Carità;Carità;=;Carità;Carità;=;Carità;Carità;=;Carità;Carità;=;Carità;Carità;=;Carità;Carità;=;Carità;Carità;=;Carità;Carità;=;Carità;Carità;=;Carità;Carità;=;Carità,Accare
1280,,,Foglie;come;te;code;o;per;ad;afferitunerario;Foglie;come;te;code;o;per;ad;afferitunerario;;,
1281,ossi;stato;ossi;stato;ossi;stato;ossi;stato;ossi,B R ossi ME stato,Brossi;mestato;;Brossi;mestato;;Brossi;mestato;;Brossi;mestato,Brossi mestato
1282,api;Cola;pedine,U N api C Cola T O R pedine,Una;piccola;torpedine,Una piccola torpedine
1283,,Scrivere,,Scrivere
1284,ali;tede;pino,M ali T tede DI pino,Malite;di;pino,Malite di pino
1285,,Ufficio,,Ufficio
1286,,FI N [Forti quadrupedi] M [Cammina in modo goffo] [Collinetta sabbiosa] CO [Effimere tracce] N [Sono alle spalle degli alpini] Q U A,Fin;italiano;m;uno;liscio;linare;Fin;italiano;m;uno;liscio;linare,
1287,,Piante con aculei N Babà... immangiabile I N armi primordiali,Cardin;bi;ancona,Piante con aculei N Babà... immangiabile I N armi primordiali = Cardi
1288,,Sotto,S;o;sotto,Sotto
1289,,[Tra Ludwig e Beethoven] = van,Vandalo;Lipuniti,Vandalo Lipuniti
1290,medi;pialla;come;come;pialla;come;come;pialla;come,Non medi NG pialla,Non;m;ingiulla;R;isiologica;R;isiologica,Non m'ingiulla
1291,,P Totò sale NNO,Potato;sol;anno,Potato sol anno
1292,,COM Pagina,,Composta
1293,,DO vestire la moglie e spogliare il marito,D;Oste;Ritolta;Mando,Donare
1294,,,Artisti;stipin;Lesa,
1295,piante;colomba,S piante RN colomba,Spiante;RNcola,Spiante RNcola
1296,,Quinto,,Quinto
1297,,Alba (il punto in cui albeggia) = Alba,Alba;Bibbia,Alba Bibbia<|end|><|endoftext|>
1298,sala;Toro;odori,In sala T Toro M odori,Insalata;to;morodori,Insalata to morodori
1299,,COM Cali,,Comali
1300,,Colt,,Colt
1301,,ER gichero S aperto LL epoca pagaia L E gabbie,E;rgi;chio;saperto;leggibe,Ergicòro
1302,,la I pisello NA,Lapis;lena;;Pigna;stella;;Vino;stella,Lapis lena
1303,tetri;rivali;pari,R E tetri rivali pari RA,Retri;rivali;pari,Retri rivali pari RA
1304,,TA Italia CO arnesi il giorno più breve E V,TAitalia;carnesi;TAitalia;carnesi,TA Italia CO arnesi il giorno più breve E V = TA Italia CO arnesi il giorno più breve E V
1305,,AS [Indica... quanto man ca] = come,come,come<|end|><|endoftext|>
1306,,[Equivale a... à la page] C [Puledri di latte] B [Raganelle verdi] S [Preposizione... divisoria] [Arnesi dei mietitori] ON E,Equivalare;ad alpacce,Equivalare ad alpacce
1307,Po;aromi;lati,Po M aromi P E lati,Pomaromi;pelati,Pomaromi pelati
1308,,DI GNASTO,,Gnasti
1309,Willem;da;cacciatori,V I Willem da cacciatori N TE,Vivi;meccanicatori,Vivi meccanicatori
1310,,Mano Trio Giallo SS Nido A,Manotrio;giallo;sssnidopera;Manotrio;giallo;sssnidopera,Mano Trio Giallo SS Nido A = Mano Trio Giallo
1311,Apis;Ceca;Oristano,U N Apis C Ceca M AN Oristano,Una;piscace;manorista,Una piscace manorista
1312,,Tata Tata,,Tata Tata
1313,,Un altare per riti pagani T Po M P I Amore,,Un altare per riti pagani T Po M P I Amore = Altare per riti pagani T Po M P I Amore
1314,,[Si razionano durante le carestie] N [Preposizione che non lascia soli] DO [Un antiruggine],,
1315,Parigi;pine,con Parigi ROV pine,Conpari;girovine,Conpari girovine
1316,ali;leoni;Adone,V ali leoni Z I Adone VA,Valli;eolistiche;;R;i;s;o;l;vi;amo;questa;risoluzione;,Valli eolistiche
1317,,Muro Tato,Otto;metro,Muro Tato
1318,,Miserere (Miserere è l'opera verdiana composta per celebrare l' apertura del canale di Suez) bello (un bel... tipo singolare) D naso (si sentono col naso) E N T (divorati dal fuoco),MI;ser;bel;l;onniesent;MI;ser;bel;l;onniesent,Miserere bello D naso E N T
1319,Cipolla;pan;colato;canto;barile,,Cipo;laspancolato;alca;natali;Cipo;laspancolato;alca;natali;;Cipo;laspancolato;alca;natali;;;Cipo;laspancolato;alca;natali;;;Cipo;laspancolato;alca;natali;;;C,
1320,,I con S code partita,,I con S code partita
1321,,Afora,,Afora
1322,ossa;Maggio;nata,B ossa Maggio F FI nata,Bossa;magg;offina,Bossa magg offina
1323,rose;sa;retti,SAN rose S sa S T retti,SANROSE;sassi;stretti,SANROSE sassi stretti
1324,baino;medi;Cooper,C baino medi M A Cooper I,Cabain;ommediamente,Cabain ommediamente
1325,,Cigno (uccello venerato dagli Egizi) = cigno,Cig;neso;papparticolani;sosore;castorini;Cig;neso;papparticolani;sosore;castorini;;Cig;neso;papparticolani;sosore;castorini;;Cig;neso;papparticolani;sosore;castorini;;Cig;neso,Cig neso papparticolani sosore castorini NTI
1326,sassate;centesimi;rete,B sassate B centesimi N rete,Bassa;tesiminerete,Bassa tesiminerete
1327,,[È simile all' ics] = ci,Cipieramaster;Burla,Cipieramaster Burla
1328,Olim;gelsomina,V Olim gelsomina NTè,Voli;m;gelosine;;R;i;s;o;l;i;v;a;m;isi;onte;;C;i;s;i;o;n;t;e;;C;i;s;i;o,Voli m'gelosine
1329,,Ivi Natale Asi,,Ivi Natale Asi
1330,,Cisterna,,Cisterna
1331,sole;eco;clave,sole N N eco N clave,Sole;neoclave,Sole neoclave<|end|><|endoftext|>
1332,,[Famose quelle di Toledo] = lame,L;amedicina;per;il;dipino,Lame Di C I N ape RI LDI pino
1333,maestra;cioccolata,U maestra LIS cioccolata,Uma;esaltazione,Uma esaltazione
1334,,"AF amo (modestamente) [Soggiorno] R A [Nel poker, batte la doppia] [Illuminavano antiche cerimonie nuziali] LB I [Si può fare ad occhi aperti] [Produce pannocchie] IS [Fune, spago] NO",Afamoso;mod;est;si;gora;si;gonasi;si;si;gonosia;Afamoso;mod;est;si;gora;si;gonasi;si;si;gonosia;;Afamoso;mod;est;si;gora;si;gonasi;si;si;gonosia;;Afamoso;mod;est;si;gora;si;gonasi;si;si;gonosia;;Afamoso;mod;est;si;gora;si,Afamoso
1335,casse;tino;cane;cane;cane;cane;cane;cane,ME casse S tino,Meca;sestino;;Risca;necaneca;;Risca;necaneca,Meca sestino
1336,,Rane,Ranevare;indicare,Rane
1337,,A cartilagine R formica B ritornati al proprietario,Cinque;formica;ritornati;Cinque;formica;ritornati,Cartilagine
1338,,TA Berna filtra IN GH Ireland T poesie care a Carducci O salute,Tabella;filtrianghi;di;lettor;sale,TA Berna filtra IN GH Ireland T poesie care a Carducci O salute
1339,palla;avalanga;Lazzaro,palla GN avalanga MB I Lazzaro,Palla;valanga,Palla valanga
1340,piede;rosa,Pro piede B rosa,Propi;debetrosa,Propi debetrosa
1341,,Fattoria,,Fattoria
1342,,SA Persia R Rabat TA,,Saper
1343,,D E cavità R cola NTI,Decavi;taccolanti,Decavi taccolanti
1344,,L A biette dello spaccalegna N lavorano nell'ombra G esperti nel mestiere,Labiet;esplorazione,Labiet esplorazione
1345,scassino;barile;tini,scassino M barile V A N tini,Scassino;Mbarile,Scassino Mbarile
1346,ile;dita;ali,F ile SM dita DI ali,Fili;smiditadiali,Fili smiditadiali
1347,acceso;orma;Gino,G acceso SOF orma G Gino,Gacceso;soformagino,Gacceso soformagino
1348,,N Becca suola NI,Neccasuoli;ani,Neccasuoli ani
1349,,FOR [Sono alle spalle degli alpini] M [Tre re al presepe] N [Esperto nel mestiere],,Forale
1350,,ratto rivali D I,Ratto;Rivali;;Setter;Setter;;Setter;Setter,Ratto Rivali
1351,,[La parte illuminata del giorno] = sole,Sole;Messico,Sole Messico
1352,,Un quarto di quindici,Un;ca;tre;Un;ca;n;Un;ca;n;Un;ca;n,
1353,,Il Mineo del cinema,,Il Pro<|end|><|endoftext|>
1354,re;lago;coda;re;re;lago;coda;re;re;lago;coda;re,P re lago L coda L TA re,Prelag;golc;odalta;;Prelag;golc;odalta;;Prelag;golc,Prelag golc' odalta
1355,canoa;leva,V UL canoa leva TO,Vulcano;Aleutiano,Vulcano Aleutiano
1356,,Castorini N T pancina,,Castorini N T pancina = Castorini N T pancina
1357,,Lardo,,Lardo
1358,,TO scandalo P ornava la prua delle antiche navi,Tosca;n;Donat;Donati,To scandalo
1359,,[La terzultima nota] = mi,Mibasi;cignonati,mi basi cigno nati
1360,,[Si dice puntando il dito] = per,Pare;statobè,Pare statobè
1361,,CO P,Cop;si;pista;Cop;si;pista;Cop;si;pista;Cop;si;pista;Cop;si;pista;Cop;si;pista;Cop;si;pista;Cop;si;pista,Cop
1362,,Pedana dei pugili,Pedana;Hie,Pedana dei pugili
1363,cape;artista;ore,I N cape NTO artista L ore,Incapiente;un;artista,Incapiente un artista
1364,,Tirare Natale,Tirar;n;Ate;Tirar;n;Ate;T;IriarNatale;n;Ate;T;IriarNatale;n;Ate,Tirare Natale
1365,mostri;Efesto,T mostri ARU Efesto,Tmostri;aru;efesto,Tmostri aru efesto
1366,,Meryl Streep Natale Gelato Chad,Merilaster;Natale;';Gelato Chad,Meryl Streep Natale Gelato Chad
1367,lava;pialla;lati;maiali;sala;ile,lava R O pialla lati C I maiali E I N sala B ile,l;avaro;pialla;latici;mai;a;lienalibile,
1368,[,DI sudiciato (sudiciato) [Un polo terrestre] INE,,
1369,,"[Quello fra Roma, Berlino e Tokio veniva chiamato ROBERTO] N [Governava le russie] I M [Vano tra pilastri]",,
1370,,A D giunte in coda a tutte,,Aggiunte
1371,,Centro di spinta,Tener;un;amico,Tener un amico
1372,casse;rane;corni,casse N T rane C corni E,Cassinet;racorni,Cassinet racorni
1373,,Mico,Mico,Mico
1374,,,A;Fifi;MAPSE;Pi;Estrasie,
1375,con;ultime;pendenti;con;ultime;pendenti;con;ultime;pendenti;con;ultime;pendenti,con S ultime pendenti CI,Consulti;pendenti;;Consulti;pendenti;;Consulti;pendenti,Consulti pendenti
1376,,AR fante e donna Spara R gioielli S T I,Arfante;edonospari<|end|><|endoftext|>,Arfante e donna spara rigi
1377,,[Lascia correre...] R A [Si parla a Shanghai],Lassa;correre,Lassa correre
1378,,PE RSONO,,Persona
1379,,ME teo unguenti S S cina S pasto,Meoteo;unguentissincas,Me teo unguenti S S cina S pasto
1380,,[La quinta del do] = sol,Sol;Senopere,Sol Senopere<|end|><|endoftext|>
1381,,Sassano Domenico BI ai LT RI,,Sassano Domenico BI ai LT RI = Sassano Domenico BI ai LT RI
1382,,PASTE GGI,,Pasteggi
1383,,IMpianti (Tre re al presepe) (Quelle del cavallo hanno le froge) E LI,Impianti;tini,Impianti
1384,,ME scuri di pelle SI recipiente per pesci RSA,,Me scuri di pelle SI recipiente per pesci RSA = Me scuri di pelle SI recipiente per pesci RSA
1385,,"[Il nome dell'attore Mineo] DO [La traduzione di ""cum""] V [Dentro a] [Accademia fiorentina sorta per iniziativa del cardinale Leopoldo de' Medici]",Ennio;Accademia,
1386,manca;imbocci;tino,manca T imbocci E S tino,Mancati;micocciestino,Mancati micocciestino
1387,un;attiva;urla,un A C attiva B urla,Un;acattiva;brula,
1388,filo;tasche;allievi,Bu filo T tasche RB allievi,Bufilo;ttas;che;rbali,Bufilo ttas che rbali
1389,,[Fu caro a Leopardi nell'Infinito] G IU [Il Bixio garibaldino] [Si consuma nella matita] LI,,Cantoni
1390,sno;nonna;anima,E sno TUR nonna anima,Esnob;un;nonna;anima,Esnob un nonna anima
1391,,Cattie Cattie,,Cattie Cattie
1392,,col ridotti con un sinonimo,Colli;ridotti,Colli ridotti
1393,,[Canta all' alba] = Alba,Alba;violavescia,Alba violavescia
1394,,Un [Un bel pappagallo] [Uccelli... cleptomani] T T [Si catturano con il fumo] S [Animali acquatici] P I [Il sommo poeta],Un;pappagallino;clept;omosapi,Un pappagallino clept omosapi
1395,bar;Don;Don;sei;bar,S bar Don Don sei MP bar,Sbarbado;dondoli;dondoli,Sbarbado dondoli dondoli
1396,pesi;carena,C pesi carena LE,Cpesici;carenale;;Risona;tete,Cpesici carenale
1397,pistola;rivali,E pistola rivali D I,Epistola;rivali,Epistola rivali
1398,sedutore;giacca;coperta,U sedutore N giacca U coperta,Usee;duto;racacoperta,Usee duto racacoperta
1399,Ennio;da;re;su;chi;su;Ennio;Leonardo;dare;re;su;chi;su;Leonardo,,,Ennio da re IN su chi suti Ennio a TI
1400,,COM PATIZIA MENTI DI,,Compiete
1401,,DE la,Dela;Re,Dela
1402,valigia;astri;penna;riga;penna;riga,STI valigia L L astri,Stivali;gallaistri;;R;I S;C O P;P A N T;A R I A;penna;riga;;R;I S;C O P;P A N T;A R I A;penna;riga,Stivali gallaistri
1403,palmi;acidi;cere,,Palmi;Cere,
1404,,petti CO oliva MI A rea cassa,Petti;coloiva;m;acrea,Petti coloiva m acrea
1405,,RE gabbia per pulcini M ossa U soggiorno radici mangerecce R I fori SA,Reggabia;per;poli;ci;mangerecce;Reggabia;per;poli;ci;mangerecce;;Reggabia;per;poli;ci;mangerecce;;Reggabia;per;poli;ci;mangerecce;;Reggabia;per;poli;ci,Reggabia per pulcini mossa ussoggiornare radici mangerecce R I fori SA
1406,,Cacao NT A,Cac;acantoni;un;tifabesco;bambamenta;Caca;acantoni;un;tifabesco;bambamenta,Cacao
1407,ava;colli;stria,Un ava C AN colli stria,Una;vacanza;co;lista,Una vacanza co lista
1408,,S C iene lacertella NE,Scienela;certe;;Scienela;certe;;Scienela;certe,Scienela certe
1409,,[La Tassinari soprano] T [Rosicchia furtivamente] R [Le mettono i magistrati] SE,,
1410,,Satiro sacro agli antichi,,Satiro
1411,,Naso Tipo,,Naso Tipo
1412,,seme sei NZ,Semese;si;Enz;;Donde;do;dietro;;Dietro;do;Don,Semese si Enz
1413,,crepuscolo sedia L T amare A,Crep;us;colo;sedia,Crepuscolo sedia
1414,,RIN Arona R puledri da latte,,Rinari
1415,,Pista Togia O,,Pista Togia O
1416,,Scalfaro,Scalfarò;farò;(Il colore più scuro) 2 = (Il colore intermedio) 3 = (Il colore più luminoso) 4 = (Il colore più scuro) 5 = (Il colore intermedio);bianco;nero;grigio;nero;grigio,Scalfaro
1417,remare;in;golf,remare P R in CI golf,Rem;apremigolf,Rem apremigolf<|end|><|endoftext|>
1418,,DI barile ND,,Barile
1419,,[Confini di Francia] L [Un pesciolino simile all'alice] TI,Le;letti;Le;letti,Le Letti
1420,,Icaro,,Icaro
1421,Ares;meno;armi,F Ares meno armi O NI,Far;esomarimoni,Far esomarimoni
1422,,AM scandalo P ornava la prua delle antiche navi,Amo;il pane;la prua;Amo;il pane;la prua,Amo il pane
1423,,CHI Piante rampicanti for Lionel,Chi;pianterai;Chi;pianterai,Chi piante rampicanti for Lionel = Chi piante rampicanti for Lionel
1424,,[Dietro la poppa] L [È fra Tunisia ed Egitto] N C [Lo sono stelle e pianeti],Posta;Tunisia Navigazione,Posta Tunisia Navigazione
1425,testa;acino,VI testa acino TI,Vi;testacanoti,Vi testacanoti
1426,,U PP A,Up;MpAmitre;Cipro,Up
1427,,FOR [Ragazza triestina] [La madre di Zeus] L [Le biette dello spaccalegna] P O [La si sostiene],,
1428,,C attiva B allori,Cattiva;ballori,Cattiva ballori
1429,,Pi LI addome IE,Piladdome;d;omie,Piladdome d omie
1430,,Cipriano,,Cipriano
1431,,Soda Pepsi,,Soda Pepsi
1432,,[Curano il gregge] Z [L' imperatrice russa] UT O [Armi primordiali],Curazione;di;autodidatti,Curazione di autodidatti
1433,okra;lati,C okra N G E lati,Col;ragelati,Col ragelati
1434,,Palla in rete! O S aviola T fa strizzare l'occhio [Sono sedici in una libbra] RE [Poco propenso] C C [Una barca sportiva],,Palla in rete! O S aviola T fa strizzare l'occhio sedici RE [Poco propenso] C C barca
1435,ci;collegati;dea;ora;ci;collegati;dea;ora;ci;collegati;dea;ora,F O ci collegati dea N C ora,Foci;che;collega;tienca;Foci;che;collega;tienca;Foci;che;collega;tienca,Foci che collega tienca
1436,pina;sciarpe,FIS pina R sciarpe,Fispina;rascari,Fispina rascari
1437,,Sambuca,Sambuca<|end|><|endoftext|>,Sambuca
1438,,GIO: [Insieme] D [Proprio in quel luogo] [Stanno nel divano] [Può nidificare in città] TI,Giocanti;disti;sistemi,GIO: congiunti D siti sistemati nel divano
1439,,BR Parenti COM,Bra;Mante,Bramante
1440,,Mano li oste N O,Manolioste;nozione,Mano li oste N O = Mano li oste N O
1441,,[Tante erano le Grazie] = molte,Molte;cioccolat;rettu;furgonding,Molte cioccolata RE T uff corde N I N G ad
1442,,Fandonie T Fugge il gatto R SE,,Fandonie T Fugge il gatto R SE = Fandonie T Fugge il gatto R Se
1443,,UO piede RT Eris,Uop;edertesi,Uop edertesi
1444,,Modulazioni note,Mod;ulazione;Pic;coliami;Pic;coliami,Modulazione
1445,leoni;erosi;tenuti;tenuti;tenuti;tenuti;tenuti;tenuti;tenuti;tenuti,OR leoni N erosi,Orle;onerosi;;Rist;tenuti;;Rist;tenuti;;Rist;tenuti,Orle onerosi
1446,birra;orata;aceto,Un birra RI orata DO aceto,Un;birrario;datato,Un birrario datato
1447,,[Alcuni sono a spillo] = pali,Palitò;piumose,Palitò piumose<|end|><|endoftext|>
1448,,Ennio poi TE RE,Ennio;Poitiers;;S;e;t;t;e;r;;S;e;t;t;e;r;;S;e;t;t;e;r,Ennio Poitiers
1449,barche;ceneri;penne;perché;penne;perché,T U barche N ceneri,Tubar;cenere;;Risper;perché;;Risper;perché,Tubar cenere
1450,,Mano Nato,,Manato
1451,,barile STI,Baril;esti,Baril esti
1452,odorati;acuto,Br odorati ST acuto,Brondo;ratistacuto,Brondo ratistacuto
1453,,NO [CHIAVE: Una Famosa cantante italiana] [Capitale del Marocco] I,,NO Mina Rabat I
1454,,Cipriano,,Cipriano
1455,rafficone;facile;petto,T rafficone N facile S petto,Trafficone;nascelle,Trafficone nascelle
1456,con;clave;fa;el,con clave fa el,Conclave;fael,Conclave fael
1457,aragosta;somme,V aragosta D I somme,Vara;gostadismo,Vara gostadismo
1458,,A autentica L le biette dello spaccalegna GE NI le hanno variopinte le farfalle,,A autentica L le biette dello spaccalegna GE NI le hanno variopinte le farfalle
1459,conte;proclamazione;minuta,conte proclamazione minuta,Contepro;clamata,Contepro clamata
1460,,S C Aci,,Sci
1461,,GOB bar,,Gobbar
1462,,Caccia Lissa N Neri T,Caccia;lissan;neri t;Caccia;lissan;neri t;;Caccia;lissan;neri t;;Caccia;lissan;neri t;;Caccia;lissan;neri t;;Caccia;lissan;neri t;;Caccia;lissan;neri t;;Caccia;lissan;neri t;;Caccia;lissan;neri t;;Caccia;lissan;neri t;;Caccia;lissan;neri t,Caccia Lissa N Neri T = Caccia Lissa N Neri T
1463,,VA Benaco L affilata T,VAben;acol;affilata,VA Benaco L affilata T = VA Benaco L affilata T
1464,adorna;tra;siepi,M adorna LIS tra siepi O NI,Madornali;strasipioni,Madornali strasipioni
1465,,Costa Rica MUN,,Costa Rica
1466,,[Rendono... gradassi i grassi] = rendono,Rend;onzipunuti,Rend onzipunuti
1467,Ares;quindici;libri,NOT Ares quindici I libri,Notare;squinidili,Notare squinidili
1468,snella;Petri;messi,UO snella S Petri messi,Uosnela;spettrimi,Uosnela spettrimi
1469,ale;valletto;cane,B ale valletto M AI cane,Bal;vallet;omiacane,Bal vallet omiacane
1470,,LIN Peso,,Linee
1471,,[I successori di san Pietro] R O L [La testata di un missile] L [Pubblici Istituti],,Papi
1472,,[L' esamina il radiologo] D [L'opposto di chiuso] RN [Superficie calcolata] C A [Sano in parte],E;SMEMO;per;esame;d;area,
1473,,peso vite RV baba,Pesovite;Rvbababa,Pesovite Rvbababa
1474,,LA Anna C Ceca,ANA;NACCA,L'Anna Nacca
1475,,Vespa Sipari,Vesa;sipariata;sipariata;per;sipari,Vespa Sipari
1476,Ain;polpo,PR Avi C C,Prativa;Inpolposa,Pravicc
1477,,RI M bello,,Miele
